{
  "claim": "MOCK：数据到模块的流向（sankey）。",
  "chart": "sankey",
  "data": "data.csv",
  "encoding": {"source": "source", "target": "target", "value": "value"},
  "size": {"preset": "single"},
  "theme": {"style": "paper-clean", "palette": "d3-blue", "font": "sans"},
  "labels": {"values": false, "legend": "none"},
  "output": {"formats": ["png", "pdf", "svg"], "dpi": 300, "svg_text": true}
}
