{
  "claim": "MOCK：两个方法的 latency/throughput 关系，带线性趋势与 95% 置信椭圆。",
  "chart": "scatter",
  "data": "data.csv",
  "encoding": {
    "x": "group",
    "y": "value",
    "series": "series"
  },
  "size": {
    "preset": "single"
  },
  "theme": {
    "style": "paper-clean",
    "palette": "d3-blue",
    "font": "sans"
  },
  "labels": {
    "values": false,
    "legend": "top"
  },
  "output": {
    "formats": [
      "png",
      "pdf",
      "svg"
    ],
    "dpi": 300,
    "svg_text": true
  },
  "axis": {
    "x_label": "Latency (ms)",
    "y_label": "Throughput",
    "x_min": 0,
    "x_max": 100
  },
  "series_order": [
    "method-1",
    "ours"
  ],
  "series_labels": {
    "method-1": "Method 1",
    "ours": "Ours"
  },
  "stats": [
    {
      "kind": "trend",
      "method": "linear"
    },
    {
      "kind": "confidence-ellipse",
      "level": 0.95
    }
  ],
  "reference": [
    {
      "axis": "y",
      "value": 80,
      "label": "target"
    }
  ]
}
