{
  "claim": "MOCK：二维参数网格上的 wireframe mesh。",
  "chart": "mesh3d",
  "data": "data.csv",
  "encoding": {"x": "x", "y": "y", "z": "z"},
  "size": {"preset": "single"},
  "theme": {"style": "paper-clean", "palette": "d3-blue", "font": "sans"},
  "labels": {"values": false, "legend": "none"},
  "output": {"formats": ["png", "pdf", "svg"], "dpi": 300, "svg_text": true},
  "axis": {"x_label": "Learning rate", "y_label": "Weight decay", "z_label": "Loss"},
  "view": {"elev": 24, "azim": -55}
}
