{
  "claim": "MOCK：两个方法的 latency ECDF，比较尾部。",
  "chart": "ecdf",
  "data": "data.csv",
  "encoding": {
    "x": "group",
    "y": "value",
    "series": "series"
  },
  "size": {
    "preset": "single"
  },
  "theme": {
    "style": "paper-clean",
    "palette": "blue-orange",
    "font": "sans"
  },
  "labels": {
    "values": false,
    "legend": "top"
  },
  "output": {
    "formats": [
      "png",
      "pdf",
      "svg"
    ],
    "dpi": 300,
    "svg_text": true
  },
  "axis": {
    "x_label": "Latency (ms)",
    "y_label": "ECDF",
    "x_min": 0,
    "x_max": 120
  },
  "series_order": [
    "method-1",
    "ours"
  ],
  "series_labels": {
    "method-1": "Method 1",
    "ours": "Ours"
  }
}
