{
  "claim": "MOCK：四层 × 五任务的指标矩阵。",
  "chart": "heatmap",
  "data": "data.csv",
  "encoding": {"row": "row", "col": "col", "value": "value"},
  "size": {"preset": "single"},
  "theme": {"style": "paper-clean", "palette": "d3-blue", "font": "sans", "colormap": "Blues"},
  "labels": {"values": true, "legend": "none"},
  "output": {"formats": ["png", "pdf", "svg"], "dpi": 300, "svg_text": true},
  "axis": {"x_label": "Task", "y_label": "Layer"}
}
