{
  "claim": "MOCK：四个模态之间的交叉流量（chord）。",
  "chart": "chord",
  "data": "data.csv",
  "encoding": {"source": "source", "target": "target", "value": "value"},
  "size": {"preset": "single"},
  "theme": {"style": "paper-clean", "palette": "tol-bright", "font": "sans"},
  "labels": {"values": false, "legend": "none"},
  "output": {"formats": ["png", "pdf", "svg"], "dpi": 300, "svg_text": true}
}
