{
  "claim": "MOCK：比较 CE / LS 两种 setting 下 Correct 与 Incorrect 的 confidence 分布。",
  "chart": "distribution-overlap",
  "data": "data.csv",
  "encoding": {
    "value": "value",
    "series": "series",
    "panel": "panel"
  },
  "size": {
    "preset": "double"
  },
  "theme": {
    "style": "paper-clean",
    "palette": "blue-orange",
    "font": "sans"
  },
  "labels": {
    "values": false,
    "legend": "top"
  },
  "output": {
    "formats": [
      "png",
      "pdf",
      "svg"
    ],
    "dpi": 300,
    "svg_text": true
  },
  "axis": {
    "x_label": "Maximum Predicted Probability",
    "y_label": "Density",
    "x_min": 0,
    "x_max": 1,
    "bins": 20
  },
  "title_prefix": "Figure 4 | ",
  "series_order": [
    "correct",
    "incorrect"
  ],
  "series_labels": {
    "correct": "Correct",
    "incorrect": "Incorrect"
  }
}
